{
    "title": "Триггеры самоубийств и самопожертвований (сцены главы 2)",
    "note": "Что именно в главе 2 (сцена, время, действие, проверка) может запустить S0X (несчастный случай / болезнь / одержимость) или самопожертвование, ведущее к path_1–path_4. Триггер — не приговор: он запускает стадию внушения/давления, игроки могут вмешаться. Привязан к модели одержимости §1.5a (04-chapter-3.md) и к path_1–path_4 (§4.2).",
    "general_rules": [
        "Триггер — не приговор: запускает стадию внушения/давления, а не акт. Игроки могут вмешаться, снять стадию или предложить помощь.",
        "Триггер привязан к сцене главы 2. Если сцена не сыграна — триггер не срабатывает.",
        "Один триггер — одна стадия. Повторный триггер той же сцены не углубляет, если не выполнено условие эскалации.",
        "Проверка сопротивления: Оккультизм/Религия/Воля СЛ 12 (СЛ 15 — призрачное внушение). Успех — персонаж распознаёт чужую мысль и может сопротивляться. Медицина СЛ 15 — определение причины смерти.",
        "Тайное время (00:00–02:00) — окно, когда триггеры срабатывают без свидетелей. Днём — только через сцену."
    ],
    "stages": [
        { "name": "Шёпот", "description": "Мысль появилась. Персонаж может отмахнуться." },
        { "name": "Навязчивость", "description": "Мысль возвращается. Рационализация." },
        { "name": "План", "description": "Выбран способ. Ещё можно остановить." },
        { "name": "Акт", "description": "Самоубийство / самопожертвование (S0X или path_X)." }
    ],
    "possession_note": "Триггеры «одержимость» касаются только 4 из 6, кого призрак может одержать: tavern_keeper, sailor, waitress, doctor. detective и artist вне круга Призрака — их S0X чисто человеческий (без эктоплазмы).",
    "triggers": {
        "tavern_keeper": {
            "key_chain": "T1 → T3 → T6/T7 = путь к S0X (одержимость) у портрета или на могиле.",
            "items": [
                { "id": "T1", "trigger": "Игроки показывают wife_ghost / ghost_testimony", "scene": "Двор, wife_grave (18:30+)", "what": "Призрак Жены говорит правду: Моряк убил её и угрожал дочери", "motivation": "Стыд + вина", "stage": "Шёпот" },
                { "id": "T2", "trigger": "Игроки раскрывают контрабанду (contraband, contraband_crate)", "scene": "Кабинет / smuggler_storage (20:00–00:00)", "what": "Всё, что он строил, — преступление", "motivation": "Стыд + потеря смысла", "stage": "Навязчивость" },
                { "id": "T3", "trigger": "Игроки раскрывают культ Официантки", "scene": "cult_lair / допрос (00:00–02:00)", "what": "«Я не защитил её. Я вырастил это»", "motivation": "Стыд + долг", "stage": "Навязчивость" },
                { "id": "T4", "trigger": "Моряк угрожает при игроках", "scene": "tavern_hall / smuggler_storage (20:00–02:00)", "what": "Мысль, что он слаб", "motivation": "Стыд + контроль", "stage": "Шёпот" },
                { "id": "T5", "trigger": "Доктор публично унижает из-за Официантки", "scene": "Кухня (19:30)", "what": "«Ты не хозяин даже в своём доме»", "motivation": "Стыд + контроль", "stage": "Шёпот" },
                { "id": "T6", "trigger": "Видит портрет жены после сцены с призраком", "scene": "tavern_hall (22:00–00:00)", "what": "«Я иду к тебе» — мысль о воссоединении", "motivation": "Любовь", "stage": "План" },
                { "id": "T7", "trigger": "Игроки говорят, что его смерть освободит дочь", "scene": "Допрос (00:00–02:00)", "what": "«Твоя смерть освободит дочь» (внушение Призрака)", "motivation": "Одержимость (внушение)", "stage": "План" },
                { "id": "T8", "trigger": "Застаёт Моряка у могилы жены", "scene": "wife_grave (00:00–02:00)", "what": "Вспышка ярости → смерть как наказание", "motivation": "Аффект", "stage": "Акт (риск)" }
            ]
        },
        "sailor": {
            "key_chain": "M1 → M4 → M8 = самопожертвование ради остановки потопа (path_1).",
            "items": [
                { "id": "M1", "trigger": "Призрак Жены является Моряку", "scene": "wife_grave / cult_lair (00:00–02:00)", "what": "«Ты должен заплатить. Твоя смерть снимет заклинание»", "motivation": "Одержимость + стыд", "stage": "Шёпот" },
                { "id": "M2", "trigger": "Игроки раскрывают дезертирство / кражу казны", "scene": "Допрос / sailor_hiding (20:00–02:00)", "what": "«Всё кончено. Тебя повесят»", "motivation": "Фатализм + стыд", "stage": "Навязчивость" },
                { "id": "M3", "trigger": "Детектив накрывает контрабанду", "scene": "smuggler_storage (20:00–00:00)", "what": "«Ты в ловушке. Выхода нет»", "motivation": "Фатализм", "stage": "Навязчивость" },
                { "id": "M4", "trigger": "Игроки понимают: его смерть остановит потоп (path_1)", "scene": "Допрос / исследование (00:00–02:00)", "what": "«Ты — цель заклинания. Твоя смерть спасёт всех»", "motivation": "Долг", "stage": "План" },
                { "id": "M5", "trigger": "Напивается у камина / в комнате", "scene": "tavern_hall / sailor_room (20:00–02:00)", "what": "Секундная вспышка, паника", "motivation": "Аффект", "stage": "Акт (риск)" },
                { "id": "M6", "trigger": "Официантка / Призрак обвиняют при свидетелях", "scene": "tavern_hall / wife_grave (00:00–02:00)", "what": "«Ты — грязь. Ты не заслужил жить»", "motivation": "Стыд", "stage": "Навязчивость" },
                { "id": "M7", "trigger": "Видит, как культисты готовят ритуал", "scene": "cult_lair (00:00–02:00)", "what": "«Они придут за мной. Лучше сам»", "motivation": "Фатализм + контроль", "stage": "План" },
                { "id": "M8", "trigger": "Игроки говорят, что его смерть — «правильный выход»", "scene": "Допрос (00:00–02:00)", "what": "Призрак: «Ты знаешь, что должен»", "motivation": "Одержимость", "stage": "План" }
            ]
        },
        "waitress": {
            "key_chain": "W2 → W6 → W7 = ритуальное самопожертвование на алтаре (path_2).",
            "items": [
                { "id": "W1", "trigger": "Игроки находят waitress_diary", "scene": "waitress_room (22:00–00:00)", "what": "Дневник раскрывает ритуал и потоп", "motivation": "Стыд + долг", "stage": "Шёпот" },
                { "id": "W2", "trigger": "Игроки раскрывают культ (cult_lair, reliquary_skull)", "scene": "cult_lair (00:00–02:00)", "what": "«Культ раскрыт. Ты — причина»", "motivation": "Стыд + долг", "stage": "Навязчивость" },
                { "id": "W3", "trigger": "Художник раскрыт как охотник на культистов", "scene": "mansard / допрос (00:00–02:00)", "what": "«Ты «запала» на убийцу. Ты предала культ»", "motivation": "Стыд + любовь", "stage": "Навязчивость" },
                { "id": "W4", "trigger": "Доктор в опасности (игроки угрожают / Художник идёт к нему)", "scene": "doctor_room / cult_lair (00:00–02:00)", "what": "«Только твоя смерть защитит его»", "motivation": "Любовь + долг", "stage": "План" },
                { "id": "W5", "trigger": "Отец (Трактирщик) убит или раскрыт", "scene": "tavern_keeper_office (02:00+)", "what": "«Ты потеряла всё. Культ — единственное»", "motivation": "Потеря смысла + долг", "stage": "План" },
                { "id": "W6", "trigger": "Призрак Жены шепчет у алтаря", "scene": "cult_lair (00:00–02:00)", "what": "«Твоя смерть защитит культ. Дагон примет тебя»", "motivation": "Одержимость + фатализм", "stage": "План" },
                { "id": "W7", "trigger": "Потоп начинается / вода в cult_lair", "scene": "07:15+ (глава 5)", "what": "«Ты можешь остановить это. Только ты»", "motivation": "Долг + самопожертвование", "stage": "Акт" },
                { "id": "W8", "trigger": "Игроки / Художник обвиняют в смерти Моряка", "scene": "Допрос (00:00–02:00)", "what": "«Ты — убийца. Ты не заслужила жить»", "motivation": "Стыд", "stage": "Навязчивость" }
            ]
        },
        "doctor": {
            "key_chain": "D4 → D5 → D7 = самопожертвование ради обратного ритуала (path_3).",
            "items": [
                { "id": "D1", "trigger": "Игроки находят doctor_dagger / doctor_note", "scene": "doctor_room (20:00–02:00)", "what": "Раскрытие культа и любви к Официантке", "motivation": "Стыд + любовь", "stage": "Шёпот" },
                { "id": "D2", "trigger": "Трактирщик запрещает видеться с Официанткой", "scene": "Кухня (19:30)", "what": "«Ты не достоин её. Ты — никто»", "motivation": "Стыд + потеря смысла", "stage": "Шёпот" },
                { "id": "D3", "trigger": "Официантка отвергает / выбирает Художника", "scene": "tavern_hall (19:00–19:45)", "what": "«Она не твоя. Ты потерял её»", "motivation": "Любовь + потеря смысла", "stage": "Навязчивость" },
                { "id": "D4", "trigger": "Игроки раскрывают культ Официантки", "scene": "cult_lair / допрос (00:00–02:00)", "what": "«Она — жрица. Ты — член культа. Вы обречены»", "motivation": "Стыд + фатализм", "stage": "Навязчивость" },
                { "id": "D5", "trigger": "Официантка в опасности (Художник / игроки)", "scene": "waitress_room / cult_lair (00:00–02:00)", "what": "«Только твоя смерть закроет ритуал. Ты — последний жрец»", "motivation": "Любовь + долг", "stage": "План" },
                { "id": "D6", "trigger": "Призрак / Официантка шепчут", "scene": "cult_lair / doctor_room (00:00–02:00)", "what": "«Ты можешь спасти её. Только твоя смерть»", "motivation": "Одержимость + долг", "stage": "План" },
                { "id": "D7", "trigger": "Потоп начинается", "scene": "07:15+", "what": "«Ты можешь провести обратный ритуал. Ценой жизни»", "motivation": "Долг (path_3)", "stage": "Акт" },
                { "id": "D8", "trigger": "Игроки обвиняют в смерти Официантки", "scene": "Допрос (02:00+)", "what": "«Ты не спас её. Ты виноват»", "motivation": "Стыд + потеря смысла", "stage": "Акт (риск)" }
            ]
        },
        "detective": {
            "key_chain": "Det1 → Det3 → Det7 = S0X в комнате (алкоголь / яд), без Призрака (Детектив вне круга Призрака).",
            "possessable": false,
            "items": [